{
  "$schema": "https://json-schema.org/draft/2020-12/schema",
  "$ref": "#/$defs/ArtifactReleased",
  "$defs": {
    "ArtifactReleased": {
      "type": "object",
      "properties": {
        "event": {
          "type": "string",
          "description": "The event name. Matches X-Tmesis-Event.",
          "const": "artifact.released"
        },
        "delivery": {
          "type": "string",
          "description": "The delivery ULID. Matches X-Tmesis-Delivery. Duplicated in the body so a receiver that logs bodies has the dedupe key without the headers."
        },
        "occurred_at": {
          "type": "string",
          "description": "RFC3339 UTC, when the event happened on the node. ORDER BY THIS, never by arrival: delivery is unordered."
        },
        "node": {
          "type": "string"
        },
        "node_role": {
          "type": "string",
          "enum": [
            "edge",
            "origin",
            "transcoder",
            "standalone"
          ]
        },
        "contract_version": {
          "type": "integer"
        },
        "stream": {
          "description": "The stream the generation came from; null for a job generation, which names job_id instead.",
          "oneOf": [
            {
              "type": "string"
            },
            {
              "type": "null"
            }
          ]
        },
        "session": {
          "description": "The publish session the generation came from; null for a job generation.",
          "oneOf": [
            {
              "type": "string"
            },
            {
              "type": "null"
            }
          ]
        },
        "session_epoch": {
          "description": "The session's epoch, the publish identity. Not the fencing epoch. Null for a job generation.",
          "oneOf": [
            {
              "type": "integer"
            },
            {
              "type": "null"
            }
          ]
        },
        "job_id": {
          "description": "The transcode job a JOB generation belongs to (P10); null for a stream's. Its events route to the job's callback_url.",
          "oneOf": [
            {
              "type": "string"
            },
            {
              "type": "null"
            }
          ]
        },
        "generation": {
          "type": "string",
          "description": "The immutable output generation (a ULID). Every artifact route and event keys on this."
        },
        "kind": {
          "type": "string",
          "enum": [
            "hls_sealed",
            "recording_ingest",
            "recording_master",
            "job_hls",
            "job_mp4",
            "job_audio",
            "job_thumbnails",
            "job_probe",
            "job_transcript"
          ]
        },
        "inventory_sha256": {
          "type": "string",
          "description": "SHA-256 of the generation's committed inventory, 64 lowercase hex digits."
        },
        "labels": {
          "type": "object",
          "additionalProperties": {
            "type": "string"
          }
        },
        "plan_revision": {
          "type": "integer",
          "description": "The plan revision the decision is bound to. A later plan makes the generation unreleased again."
        },
        "request_id": {
          "type": "string",
          "description": "The decision's identity: the caller-minted request id."
        },
        "action": {
          "type": "string",
          "enum": [
            "release",
            "override",
            "discard"
          ]
        },
        "actor": {
          "type": "string",
          "description": "The credential class the decision was accepted under.",
          "enum": [
            "admin_token",
            "open"
          ]
        },
        "reason": {
          "type": "string"
        },
        "waived_targets": {
          "type": "array",
          "description": "Target ids the decision waived. Empty for a normal release; every target for a discard. A waiver never turns a failed transfer into a success.",
          "items": {
            "type": "string"
          }
        }
      },
      "required": [
        "event",
        "delivery",
        "occurred_at",
        "node",
        "node_role",
        "contract_version",
        "stream",
        "session",
        "session_epoch",
        "job_id",
        "generation",
        "kind",
        "inventory_sha256",
        "labels",
        "plan_revision",
        "request_id",
        "action",
        "actor",
        "reason",
        "waived_targets"
      ],
      "additionalProperties": false
    }
  }
}
